{
  "$schema": "https://liujiaao.github.io/es-plus/brand/slogan.schema.json",
  "name": "ES-Plus",
  "positioning": "中后台 CRUD 的配置层",
  "positioningEn": "The Configuration Layer for Admin CRUD",
  "slogan": {
    "en": "Write once, render everywhere.",
    "zh": "中后台 CRUD 的配置层",
    "subtitle": "一份 JSON 配置 · 三个渲染器 · 生成即编译",
    "subtitleEn": "One JSON config · Three renderers · Generate then compile"
  },
  "promises": [
    {
      "key": "one-config",
      "title": "一份配置",
      "titleEn": "One Config",
      "claim": "模板与事件胶水代码减少 76.5%",
      "claimEn": "76.5% less markup + glue code",
      "desc": "同一页面、同一功能范围：模板 + 事件胶水代码 115 → 27 行（−76.5%）；整页非空行 136 → 81 行（−40.4%）。数字由构建脚本从展示的源码实测得出。",
      "descEn": "Same page, same scope: markup + event glue code 115 → 27 lines (-76.5%); whole-file non-empty lines 136 → 81 (-40.4%). Figures are measured from the code shown."
    },
    {
      "key": "cross-renderer",
      "title": "三端通用",
      "titleEn": "Cross-Renderer",
      "claim": "单 Schema → Vue2 / Vue3 / AntDV",
      "claimEn": "One Schema → Vue2 / Vue3 / AntDV",
      "desc": "同一份 JSON Schema 在 Vue 2 / Vue 3 / Ant Design Vue 三端渲染出一致界面，换一行 import 即切换。",
      "descEn": "One JSON Schema renders an identical UI across Vue 2 / Vue 3 / Ant Design Vue — switch by changing one import."
    },
    {
      "key": "ai-native",
      "title": "AI 原生生成",
      "titleEn": "AI-Native Generation",
      "claim": "MCP + 确定性编译 + CI 可编译保证",
      "claimEn": "MCP + deterministic compile + CI guarantee",
      "desc": "JSON Schema 是 AI 能可靠生成的载体，MCP / CLI 生成即编译，CI 保证真的能跑。",
      "descEn": "JSON Schema is the substrate AI can reliably generate; MCP / CLI produce compilable code, guaranteed by CI."
    }
  ]
}
